1305802393564217376,,,,,,,,,,,0,gemstar,466074113262223366,0,gemstar7192,,1303438635772809311,,"I'm Gary, a tech writer from the Bay Area, California. I'm behind schedule but catching up, thanks to <@583740882306727976>'s excellent tutorial advice: https://discord.com/channels/1101210829807956100/1303438361117069363/1305789096970686504",2024-11-12T07:52:31.261Z,,,,,,,,,,,,,,,,,,,,,,,,,,,,,,,,,,,,,,,,,,,,,,,,,,,,,,,,,,,0,,,false,,1c4fb4a2041dba457c62e5a874e373a2,,,0,Bill-Raymond,583740882306727976,0,billraymond,,,,,,,false,,,,0,false,1,0,1,,👍,false,false,,,,,,,,,,,,,,,,,,,,,,,,,,,,,,2024-11-12T07:52:31.261000+00:00,false,0,gemstar7192,
1305787547557040190,,,,,2f768524025d0f6a944edad1c0af2de6,,,,,,0,SKIDZ,492691371338235904,64,darth_kadar,,1303438635772809311,,"Hey! I'm Kadar, a student  with a strong interest in tech particularly cybersecurity as well as healthcare.  Curious about how data can drive innovation in healthcare. Excited to connect with everyone and be part of this amazing community.      Check out my LinkedIn: https://www.linkedin.com/in/kadarsaleh/ 😊",2024-11-12T06:53:31.697Z,,,,,,,,,,,,,,,,,,,,,,,,,,,,,,,,,,,,,,,,,,,,,,,,,,,,,,,,,,,0,,,false,,,,,,,,,,,,,,,,false,,,,0,false,2,0,2,,🌟,false,false,,0,false,1,0,1,,👍,false,false,,,,,,,,,,,,,,,,,,,,2024-11-12T06:53:31.697000+00:00,false,0,darth_kadar,
1305784750493143062,,,,,,,,,,,0,astute,923692797893173279,0,astute6804,,1303438635772809311,,"Hi all,

I'm Kabir from Nigeria. I am a water sustainability expert. I have background knowledge in Data Sciences and Geospatial Data Analysis. I'm currently exploring Generative AI and prompt engineering to address global environmental challenges.

Connect with me let's thrive as a team.
https://www.linkedin.com/in/atobatelekabir",2024-11-12T06:42:24.825Z,,,,,,,,,,,,,,,,,,,,,,,,,,,,,,,,,,,,,,,,,,,,,,,,,,,,,,,,,,,0,,,false,,,,,,,,,,,,,,,,false,,,,0,false,1,0,1,,👍,false,false,,,,,,,,,,,,,,,,,,,,,,,,,,,,,,2024-11-12T06:42:24.825000+00:00,false,0,astute6804,
1305762210341060651,,,,,,,,,,,0,Potlapalli Raviteja,1009163703062646885,0,potlapalli_raviteja,,1303438635772809311,,"Hi everyone 
Iam Raviteja from Hyderabad  india 
If you want to learn and work on LLM's projects 
Let's connect on
https://www.linkedin.com/in/potlapalli-raviteja",2024-11-12T05:12:50.834Z,,,,,,,,,,,,,,,,,,,,,,,,,,,,,,,,,,,,,,,,,,,,,,,,,,,,,,,,,,,0,,,false,,,,,,,,,,,,,,,,false,,,,,,,,,,,,,,,,,,,,,,,,,,,,,,,,,,,,,,,,,,2024-11-12T05:12:50.834000+00:00,false,0,potlapalli_raviteja,
1305761335597989889,,,,,ccc643188f3b8ce4743f3aef80c5eb8b,,,,,,0,Mehul Arora,585665323278139403,0,mehular0ra,,1303438635772809311,,"He all, I'm Mehul from India. Lets connect: https://www.linkedin.com/in/mehular0ra/",2024-11-12T05:09:22.279Z,,,,,,,,,,,,,,,,,,,,,,,,,,,,,,,,,,,,,,,,,,,,,,,,,,,,,,,,,,,0,,,false,,,,,,,,,,,,,,,,false,,,,,,,,,,,,,,,,,,,,,,,,,,,,,,,,,,,,,,,,,,2024-11-12T05:09:22.279000+00:00,false,0,mehular0ra,
1305724937428009011,,,,,,,,,,,0,Hira Tariq,1305720050505744437,0,hiratariq_26409,,1303438635772809311,,"Hi All! This is Hira from Pakistan 🙂 
Working as a Data Analyst currently, have a little experience in Data Science as well: https://www.linkedin.com/in/hira-tariq-524469137/
Happy to connect and really appreciate this program offering by Google, Looking forward to all the learnings!",2024-11-12T02:44:44.279Z,2024-11-12T02:45:07.879000+00:00,,,,,,,,,,,,,,,,,,,,,,,,,,,,,,,,,,,,,,,,,,,,,,,,,,,,,,,,,,0,,,false,,,,,,,,,,,,,,,,false,,,,,,,,,,,,,,,,,,,,,,,,,,,,,,,,,,,,,,,,,,2024-11-12T02:44:44.279000+00:00,false,0,hiratariq_26409,
1305721829821911180,,,,,6c5996770c985bcd6e5b68131ff2ba04,,,,,,0,Ayesha931,1286454143883415602,0,ayesha931,,1303438635772809311,,"Hello everyone! Great to be part of such a diverse program! I am Ayesha from Pakistan,  a Masters of CS student diving into LLMs. Excited to be here! Lets connect: https://www.linkedin.com/in/ayesha-naseer-656236167",2024-11-12T02:32:23.368Z,,,,,,,,,,,,,,,,,,,,,,,,,,,,,,,,,,,,,,,,,,,,,,,,,,,,,,,,,,,0,,,false,,,,,,,,,,,,,,,,false,,,,,,,,,,,,,,,,,,,,,,,,,,,,,,,,,,,,,,,,,,2024-11-12T02:32:23.368000+00:00,false,0,ayesha931,
1305698482966892597,,,,,f73459612d633e661085b549d02e5ffc,,,,,,0,,933836894901506158,0,rubayat26,,1303438635772809311,,"Hi everyone, This is Rubayat. Currently working as a software engineer in USA. Looking to have a head start in the realm of Gen AI.  Feel free to add me on LinkedIn : https://www.linkedin.com/in/rubayat-islam/",2024-11-12T00:59:37.044Z,,,,,,,,,,,,,,,,,,,,,,,,,,,,,,,,,,,,,,,,,,,,,,,,,,,,,,,,,,,0,,,false,,,,,,,,,,,,,,,,false,,,,0,false,2,0,2,,👋,false,false,,,,,,,,,,,,,,,,,,,,,,,,,,,,,,2024-11-12T00:59:37.044000+00:00,false,0,rubayat26,
1305695694471827528,,,,,00de0aa40af4499aadcfdae17d95fe2e,,,,,,0,,706011992653168641,0,jdense,,1303438635772809311,,"hi everyone, im Juan diego from peru BSC in systems engneering  looking for deeply understanding in IA 
Feel free to add me on linkedin 
https://www.linkedin.com/in/jdnse/",2024-11-12T00:48:32.215Z,,,,,,,,,,,,,,,,,,,,,,,,,,,,,,,,,,,,,,,,,,,,,,,,,,,,,,,,,,,0,,,false,,,,,,,,,,,,,,,,false,,,,0,false,1,0,1,,👋,false,false,,,,,,,,,,,,,,,,,,,,,,,,,,,,,,2024-11-12T00:48:32.215000+00:00,false,0,jdense,
1305681490624905257,,,,,,,,,,,0,edalvarez,1305676892552036454,0,edalvarez_52966,,1303438635772809311,,https://tenor.com/view/xmas-happy-dance-gif-13017096,2024-11-11T23:52:05.754Z,,,,,,1,,,,,Tenor,https://tenor.co,,0,416,OAgKDwD4N5iEe3aId5hnqGeJd/CnB30I,1,https://images-ext-1.discordapp.net/external/wsdw2ttoOaQzldkUgZUKN9Emb668q23LRPKG4gCvc2A/https/media.tenor.com/WtVnnj9BBpsAAAAe/xmas-happy.png,https://media.tenor.com/WtVnnj9BBpsAAAAe/xmas-happy.png,416,,gifv,https://tenor.com/view/xmas-happy-dance-gif-13017096,0,416,OAgKDwD4N5iEe3aId5hnqGeJd/CnB30I,1,https://images-ext-1.discordapp.net/external/p113yyjXkyM5FuR71sSt0hG50Dw7O2uFCIOxgI-30sM/https/media.tenor.com/WtVnnj9BBpsAAAPo/xmas-happy.mp4,https://media.tenor.com/WtVnnj9BBpsAAAPo/xmas-happy.mp4,416,,,,,,,,,,,,,,,,,,,,,,,,,,,,,0,,,false,,,,,,,,,,,,,,,,false,,,,0,false,1,0,1,,😆,false,false,,,,,,,,,,,,,,,,,,,,,,,,,,,,,,2024-11-11T23:52:05.754000+00:00,false,0,edalvarez_52966,
1305677744130228224,,,,,5cbd40bd3f7ef8006cdd63c662cd5fa5,,,,,,0,Marcel,1086337008345026602,0,marcelferran,,1303438635772809311,,"Im Marcel, domain data scientist in SLB <:100:1138924014623011000> , my field of experience is the O&G industry mainly subsurface disciplines. Im from Mexico 🇲🇽  and if you want to connect reach me here: https://www.linkedin.com/in/marcelcastroponcedeleon/",2024-11-11T23:37:12.520Z,,,,,,,,,,,,,,,,,,,,,,,,,,,,,,,,,,,,,,,,,,,,,,,,,,,,,,,,,,,0,,,false,,,,,,,,,,,,,,,,false,,,,0,false,1,0,1,,👋,false,false,,,,,,,,,,,,,,,,,,,,,,,,,,,,,,2024-11-11T23:37:12.520000+00:00,false,0,marcelferran,
1305672328277004288,,,,,7ec4ea4929c29c1480e187856723421f,,,,,,0,Ryan,1195238926252769372,0,rlawton.cs,,1303438635772809311,,"Hi everyone!

I'm Ryan, a Computer Science student from Southern California and a SWE Resident in Headstarter's AI/ML Accelerator program.  I found out about this 5 day course through one of our mentors, Mofi Rahman (Developer Relations Engineer at Google).

Excited to be taking this course with all of you!  If you want to connect, my LinkedIn is: https://www.linkedin.com/in/rlawton714/",2024-11-11T23:15:41.280Z,,,,,,,,,,,,,,,,,,,,,,,,,,,,,,,,,,,,,,,,,,,,,,,,,,,,,,,,,,,0,,,false,,,,,,,,,,,,,,,,false,,,,0,false,1,0,1,,👋,false,false,,0,false,1,0,1,,✅,false,false,,,,,,,,,,,,,,,,,,,,2024-11-11T23:15:41.280000+00:00,false,0,rlawton.cs,
1305657797060329473,,,,,967acee9feb87a326dc8a98e32514912,,,,,,0,lloydchang_,1067818060909645944,0,lloydchang_,,1303438635772809311,,"👋 Hi all! I’ve been a passive user on Kaggle, but I’m excited to dive into the 5-day Gen AI intensive course and participate more actively. I’m open to connecting at https://www.linkedin.com/in/lloydchang/ — Happy learning, everyone! 🙂",2024-11-11T22:17:56.768Z,,,,,,,,,,,,,,,,,,,,,,,,,,,,,,,,,,,,,,,,,,,,,,,,,,,,,,,,,,,0,,,false,,,,,,,,,,,,,,,,false,,,,0,false,2,0,2,,👋,false,false,,0,false,1,0,1,,🙂,false,false,,,,,,,,,,,,,,,,,,,,2024-11-11T22:17:56.768000+00:00,false,0,lloydchang_,
1305656736056873091,,,,,f7f2e9361e8a54ce6e72580ac7b967af,,,,,,0,Rajesh,1305651395344597013,0,rajesh_ramachandran,,1303438635772809311,,"Hi All,  I am Rajesh Ramachandran from Bristol, United Kingdom. Great to be here and looking forward to learning more on AI 

https://www.linkedin.com/in/rajeshramachandran?utm_source=share&utm_campaign=share_via&utm_content=profile&utm_medium=ios_app",2024-11-11T22:13:43.805Z,,,,,,,,,,,,,,,,,,,,,,,,,,,,,,,,,,,,,,,,,,,,,,,,,,,,,,,,,,,0,,,false,,,,,,,,,,,,,,,,false,,,,,,,,,,,,,,,,,,,,,,,,,,,,,,,,,,,,,,,,,,2024-11-11T22:13:43.805000+00:00,false,0,rajesh_ramachandran,
1305656420951396373,,,,,,,,,,,0,Kavi Sarna,1305036964004761610,0,kavisarna,,1303438635772809311,,"Hi everyone, I'm Kavi. I'm studying Data Science at Carnegie Mellon University in Pittsburgh, USA, and I have 7 years of experience as a Software Engineer. Looking forward to connecting and learning. https://www.linkedin.com/in/kavi-sarna-b84a7792/",2024-11-11T22:12:28.678Z,,,,,,,,,,,,,,,,,,,,,,,,,,,,,,,,,,,,,,,,,,,,,,,,,,,,,,,,,,,0,,,false,,,,,,,,,,,,,,,,false,,,,0,false,1,0,1,,👍,false,false,,,,,,,,,,,,,,,,,,,,,,,,,,,,,,2024-11-11T22:12:28.678000+00:00,false,0,kavisarna,
1305650856531857489,,,,,ae8c6ba606eabe0be2ea723a9fcbbbce,,,,,,0,scurrminator,392029781044101150,0,scurrminator1319,,1303438635772809311,,"Hello, Mohsin from Saudi Arabia 
https://www.linkedin.com/in/mohsin-murad",2024-11-11T21:50:22.017Z,,,,,,,,,,,,,,,,,,,,,,,,,,,,,,,,,,,,,,,,,,,,,,,,,,,,,,,,,,,0,,,false,,,,,,,,,,,,,,,,false,,,,,,,,,,,,,,,,,,,,,,,,,,,,,,,,,,,,,,,,,,2024-11-11T21:50:22.017000+00:00,false,0,scurrminator1319,
1305649603386937394,,,,,,,,,,,0,Olalytics,1261642623135780864,0,olalytics_04944,,1303438635772809311,,"Let's connect below:
https://linkedin.com/in/olanrewaju-adegoke-18012011",2024-11-11T21:45:23.244Z,,,,,,,,,,,,,,,,,,,,,,,,,,,,,,,,,,,,,,,,,,,,,,,,,,,,,,,,,,,0,,,false,,,,,,,,,,,,,,,,false,,,,,,,,,,,,,,,,,,,,,,,,,,,,,,,,,,,,,,,,,,2024-11-11T21:45:23.244000+00:00,false,0,olalytics_04944,
1305647631380516948,,,,,c0a026df361802d8607f95d5faac0757,,,,,,0,Abbas Ali,1247430932282081321,0,abbascs.exe,,1303438635772809311,,"Hello! I am Abbas Ali from Pakistan. A recent graduate of Computer Science looking to upskill my data science tool kit and help my people in the best way possible.

Looking forward to learn and grow with you guys

Here is my linkedin
https://www.linkedin.com/in/abbasalics",2024-11-11T21:37:33.081Z,,,,,,,,,,,,,,,,,,,,,,,,,,,,,,,,,,,,,,,,,,,,,,,,,,,,,,,,,,,0,,,false,,,,,,,,,,,,,,,,false,,,,,,,,,,,,,,,,,,,,,,,,,,,,,,,,,,,,,,,,,,2024-11-11T21:37:33.081000+00:00,false,0,abbascs.exe,
1305640046254227537,,,,,9a817a24491fb17e0d66ff4b68ecab0b,,,,,,0,Cocolisoft,359842496605585409,256,cocolisoft,,1303438635772809311,,"Hey everyone, Ale from Chile here (programmer, data scientist and others). I'm gonna present an LLM workshop next week  <:harold:1138901472835293195>  so I am taking this intensive just in time.

Let's connect https://www.linkedin.com/in/alexis-rivera-41b6b2333/",2024-11-11T21:07:24.646Z,,,,,,,,,,,,,,,,,,,,,,,,,,,,,,,,,,,,,,,,,,,,,,,,,,,,,,,,,,,0,,,false,,,,,,,,,,,,,,,,false,,,,,,,,,,,,,,,,,,,,,,,,,,,,,,,,,,,,,,,,,,2024-11-11T21:07:24.646000+00:00,false,0,cocolisoft,
1305638994268389447,,,,,1d24f062932272091f4c2ae3c4b54233,,,,,,0,Gappfill,368409205838970881,256,gappfill,,1303438635772809311,,Hi all! I am Misha. Feel free to connect me in linkedIn: https://www.linkedin.com/in/mikhail-pechkurov-014279280/,2024-11-11T21:03:13.833Z,,,,,,,,,,,,,,,,,,,,,,,,,,,,,,,,,,,,,,,,,,,,,,,,,,,,,,,,,,,0,,,false,,,,,,,,,,,,,,,,false,,,,,,,,,,,,,,,,,,,,,,,,,,,,,,,,,,,,,,,,,,2024-11-11T21:03:13.833000+00:00,false,0,gappfill,
1305638463109861381,,,,,f53fa744fd8db2648916b6b31b710802,,,,,,0,,420734969766346754,0,m.s.g.9010,,1303438635772809311,,"Hi all! Excited to be part of this experience! I'm Maurice, currently doing my Master's in AI at Arizona State, but originally from Peru! Feel free to add me on linkedin https://www.linkedin.com/in/maurice-gleiser/",2024-11-11T21:01:07.195Z,,,,,,,,,,,,,,,,,,,,,,,,,,,,,,,,,,,,,,,,,,,,,,,,,,,,,,,,,,,0,,,false,,,,,,,,,,,,,,,,false,,,,,,,,,,,,,,,,,,,,,,,,,,,,,,,,,,,,,,,,,,2024-11-11T21:01:07.195000+00:00,false,0,m.s.g.9010,
1305637697825542184,,,,,0030e3fd04ac480e18e1aa0295d8804b,,,,,,0,Nischal1011,664597230497562625,0,nischal1011,,1303438635772809311,,"Hi everyone! I’m Nischal, currently working as a data scientist based in Chicago, IL. Excited to be a part of this and learn more about gen AI tools. You can find me on Linkedin: https://www.linkedin.com/in/nischal1/",2024-11-11T20:58:04.737Z,,,,,,,,,,,,,,,,,,,,,,,,,,,,,,,,,,,,,,,,,,,,,,,,,,,,,,,,,,,0,,,false,,,,,,,,,,,,,,,,false,,,,,,,,,,,,,,,,,,,,,,,,,,,,,,,,,,,,,,,,,,2024-11-11T20:58:04.737000+00:00,false,0,nischal1011,
1305630877006696489,,,,,,,,,,,0,,871900287697297409,0,ui_4054,,1303438635772809311,,Here my Linkedin... https://www.linkedin.com/in/ui4054/  lets contact,2024-11-11T20:30:58.527Z,,,,,,,,,,,,,,,,,,,,,,,,,,,,,,,,,,,,,,,,,,,,,,,,,,,,,,,,,,,0,,,false,,,,,,,,,,,,,,,,false,,,,,,,,,,,,,,,,,,,,,,,,,,,,,,,,,,,,,,,,,,2024-11-11T20:30:58.527000+00:00,false,0,ui_4054,
1305627726501122119,,,,,,,,,,,0,Saqhib Bilal,1055902139572043827,0,saqhibbilal,,1303438635772809311,,"Hello Everyone!!! I am Bilal from India. Looking forward to connect with you all and learn.
https://www.linkedin.com/in/saqhibb/",2024-11-11T20:18:27.388Z,,,,,,,,,,,,,,,,,,,,,,,,,,,,,,,,,,,,,,,,,,,,,,,,,,,,,,,,,,,0,,,false,,,,,,,,,,,,,,,,false,,,,,,,,,,,,,,,,,,,,,,,,,,,,,,,,,,,,,,,,,,2024-11-11T20:18:27.388000+00:00,false,0,saqhibbilal,
1305627009392578692,,,,,c0a026df361802d8607f95d5faac0757,,,,,,0,Abbas Ali,1247430932282081321,0,abbascs.exe,,1303438635772809311,,"Hello! I am Abbas Ali from Pakistan. A recent graduate of Computer Science looking to upskill my data science tool kit and help my people in the best way possible.

Looking forward to learn and grow with you guys

Here is my linkedin
https://www.linkedin.com/in/abbasalics",2024-11-11T20:15:36.416Z,2024-11-11T20:37:08.598000+00:00,,,,,,,,,,,,,,,,,,,,,,,,,,,,,,,,,,,,,,,,,,,,,,,,,,,,,,,,,,0,,,false,,,,,,,,,,,,,,,,false,,,,0,false,1,0,1,,👍,false,false,,0,false,1,0,1,,✨,false,false,,,,,,,,,,,,,,,,,,,,2024-11-11T20:15:36.416000+00:00,false,0,abbascs.exe,
1305625211768672288,,,,,15367aaa10db79788afc5fb09992fbfb,,,,,,0,Salim,1305622697912565842,0,salim_04535_14263,,1303438635772809311,,"Hello Everyone, My name is salim, I am from Tunisia, and I am currently doing a master degree in Information technology in Italy 
I am very passionate about Artificial intelligence and Machine Learning as I am also doing my thesis and internship in this field. 
Looking forward to learning from this bootcamp and connecting with everyone !
Here is my Linkedin : https://www.linkedin.com/in/salimbenhamadi/",2024-11-11T20:08:27.829Z,,,,,,,,,,,,,,,,,,,,,,,,,,,,,,,,,,,,,,,,,,,,,,,,,,,,,,,,,,,0,,,false,,,,,,,,,,,,,,,,false,,,,0,false,1,0,1,,👍,false,false,,,,,,,,,,,,,,,,,,,,,,,,,,,,,,2024-11-11T20:08:27.829000+00:00,false,0,salim_04535_14263,
1305624125347205230,,,,,,,,,,,0,aguirre,1286402626858123396,0,aguirre_66633,,1303438635772809311,,"Hi everyone, I'm Miriam from SF Bay Area: https://www.linkedin.com/in/aguirrem/",2024-11-11T20:04:08.806Z,,,,,,,,,,,,,,,,,,,,,,,,,,,,,,,,,,,,,,,,,,,,,,,,,,,,,,,,,,,0,,,false,,,,,,,,,,,,,,,,false,,,,0,false,1,0,1,,👋,false,false,,,,,,,,,,,,,,,,,,,,,,,,,,,,,,2024-11-11T20:04:08.806000+00:00,false,0,aguirre_66633,
1305621614779437106,,,,,99546bed1004bfe36585b159fad0ab62,,,,,,0,Precious Orekha,784740979491340318,0,preciousorekha,,1303438635772809311,,"Hi guys, I’m Precious from Nigeria 🇳🇬 I’m currently a Data Science Masters student in the US 🇺🇸 
I’m happy to be here, let’ us connect : http://linkedin.com/in/precious-orekha",2024-11-11T19:54:10.240Z,2024-11-11T19:54:55.096000+00:00,,,,,,,,,,,,,,,,,,,,,,,,,,,,,,,,,,,,,,,,,,,,,,,,,,,,,,,,,,0,,,false,,,,,,,,,,,,,,,,false,,,,0,false,1,0,1,,🔥,false,false,,,,,,,,,,,,,,,,,,,,,,,,,,,,,,2024-11-11T19:54:10.240000+00:00,false,0,preciousorekha,
1305620742305615927,,,,,db28ae728eff79fccc872f141bbcfa2c,,,,,,0,siddani09,757308855800823976,0,siddani09,,1303438635772809311,,"hey folks, Sid Dani from Santa Monica, CA. I work as a product manager. Here's my LinkedIn, I would love to connect with you all. https://www.linkedin.com/in/siddani/",2024-11-11T19:50:42.226Z,,,,,,,,,,,,,,,,,,,,,,,,,,,,,,,,,,,,,,,,,,,,,,,,,,,,,,,,,,,0,,,false,,,,,,,,,,,,,,,,false,,,,0,false,1,0,1,,💯,false,false,,,,,,,,,,,,,,,,,,,,,,,,,,,,,,2024-11-11T19:50:42.226000+00:00,false,0,siddani09,
1305616836620062782,,,,,,,,,,,0,a.n.bennett,1305613910040383578,0,a.n.bennett_56556,,1303438635772809311,,Awesome! I'm in Vancouver too https://www.linkedin.com/in/alananbennett/,2024-11-11T19:35:11.038Z,2024-11-11T19:37:09.941000+00:00,,,,,,,,,,,,,,,,,,,,,,,,,,,,,,,,,,,,,,,,,,,,,,,,,,,,,,,,,,0,,,false,,,,,0,Parisa Asgharzadeh,1292895495508725762,0,parisaasgharzadeh_02945,,1303438635772809311,1101210829807956100,1305616426501148683,0,,false,0,,,0,false,1,0,1,,🤩,false,false,,,,,,,,,,,,,,,,,,,,,,,,,,,,,,2024-11-11T19:35:11.038000+00:00,false,19,a.n.bennett_56556,
1305612409989238824,,,,,a79a7f04db83d6504379863797548d10,,,,,,0,GenAI Guru,860906669637632062,0,yashkavaiya,,1303438635772809311,,"Hi there! I'm a freelance Conversational AI specialist with extensive experience in building chatbots, generative AI models, Dialogflow flows, and Discord bots. 

You can check out my portfolio of past projects here: https://amrutlal-kavaiya.github.io/projects.html

If you're looking for a skilled AI developer to bring your vision to life, I'd be excited to discuss how I can help. Let me know if you have any questions!

Looking forward to connecting.",2024-11-11T19:17:35.647Z,,,,,,,,,,,,,,,,,,,,,,,,,,,,,,,,,,,,,,,,,,,,,,,,,,,,,,,,,,,0,,,false,,,,,,,,,,,,,,,,false,,,,0,false,1,0,1,,👍,false,false,,,,,,,,,,,,,,,,,,,,,,,,,,,,,,2024-11-11T19:17:35.647000+00:00,false,0,yashkavaiya,
1305595048834109582,,,,,,,,,,,0,,327646906060636161,0,senpai_butterfingers,,1303438635772809311,,Thomas from New York https://www.linkedin.com/in/thomas-shen-976067186/,2024-11-11T18:08:36.425Z,,,,,,,,,,,,,,,,,,,,,,,,,,,,,,,,,,,,,,,,,,,,,,,,,,,,,,,,,,,0,,,false,,,,,,,,,,,,,,,,false,,,,,,,,,,,,,,,,,,,,,,,,,,,,,,,,,,,,,,,,,,2024-11-11T18:08:36.425000+00:00,false,0,senpai_butterfingers,
1305593927365169204,,,,,,,,,,,0,jsvishnu,539434776285937674,0,jsvishnu,,1303438635772809311,,"Hello everyone, vishnu from denver. Feel free to connect:https://www.linkedin.com/in/vishnu-j-s",2024-11-11T18:04:09.046Z,,,,,,,,,,,,,,,,,,,,,,,,,,,,,,,,,,,,,,,,,,,,,,,,,,,,,,,,,,,0,,,false,,,,,,,,,,,,,,,,false,,,,,,,,,,,,,,,,,,,,,,,,,,,,,,,,,,,,,,,,,,2024-11-11T18:04:09.046000+00:00,false,0,jsvishnu,
1305593844544442409,,,,,,,,,,,0,worf,690642582384017449,0,worf5590,,1303438635772809311,,"Hi All, I am Frank, nice to meet you all, and looking forward to learning from this class!  https://www.linkedin.com/in/frank-kao-889948/",2024-11-11T18:03:49.300Z,,,,,,,,,,,,,,,,,,,,,,,,,,,,,,,,,,,,,,,,,,,,,,,,,,,,,,,,,,,0,,,false,,,,,,,,,,,,,,,,false,,,,,,,,,,,,,,,,,,,,,,,,,,,,,,,,,,,,,,,,,,2024-11-11T18:03:49.300000+00:00,false,0,worf5590,
1305591714207240264,,,,,91ffdbb7e2f036933345bdf57604386e,,,,,,0,Bill,451975579030388736,0,crunchfrog,,1303438635772809311,,"Greetings! Bill Feth from Ohio, US. So great to see people from nearly every continent! I'm excited to learn more about these incredible technologies! こんにちは、ビル・フェスでございます。よろしくお願いします！

That LLMs are accessible to anyone with a computer feels like the invention of the telegraph - it unlocks so much potential, and everyone abuzz! Truly awe-some. https://www.loc.gov/item/myloc18/",2024-11-11T17:55:21.388Z,2024-11-11T17:56:04.362000+00:00,,,,,0,,,,,The Library of Congress,,,,,,,,,,What Hath God Wrought?,link,https://www.loc.gov/item/myloc18/,,,,,,,,,,,,,,,,,,,,,,,,,,,,,,,,,,,,0,,,false,,,,,,,,,,,,,,,,false,,,,,,,,,,,,,,,,,,,,,,,,,,,,,,,,,,,,,,,,,,2024-11-11T17:55:21.388000+00:00,false,0,crunchfrog,
1305586155512664174,,,,,,,,,,,0,samic,756147813032919139,0,samic6087,,1303438635772809311,,"Hello Everyone

My name is Samir Nandardhane, I am Data Scientist from California, I am working on building GenAI product, Let me know anyone interested to join me , 

Happy to connect with you all

https://www.linkedin.com/in/samirnandardhane/",2024-11-11T17:33:16.092Z,,,,,,,,,,,,,,,,,,,,,,,,,,,,,,,,,,,,,,,,,,,,,,,,,,,,,,,,,,,0,,,false,,,,,,,,,,,,,,,,false,,,,0,false,1,0,1,,👍,false,false,,,,,,,,,,,,,,,,,,,,,,,,,,,,,,2024-11-11T17:33:16.092000+00:00,false,0,samic6087,
1305586092480925736,,,,,c1034bd82dd3d46c3b95f5736ae7092e,,,,,,0,Sajjad,921335688866197514,0,gloomyglyph,,1303438635772809311,,"Hi everyone 😀
It's Sajjad. I'm a Machine Learning Engineer.
I'd love to connect with you.
https://www.linkedin.com/in/sajjad-balgheh-409117159",2024-11-11T17:33:01.064Z,,,,,,,,,,,,,,,,,,,,,,,,,,,,,,,,,,,,,,,,,,,,,,,,,,,,,,,,,,,0,,,false,,,,,,,,,,,,,,,,false,,,,0,false,1,0,1,,👍,false,false,,,,,,,,,,,,,,,,,,,,,,,,,,,,,,2024-11-11T17:33:01.064000+00:00,false,0,gloomyglyph,
1305584905178320977,,,,,,,,,,,0,UnreasonablyOpinionated,1161823888540434432,0,juanimpacts.com,,1303438635772809311,,"Hello Everyone
My name is Juan from I am logging in from Washington DC, USA. I'm working in sustainability and am excited to be learning GenAI with everyone. 
Happy to connect,

https://www.linkedin.com/in/juan-arguelles?utm_source=share&utm_campaign=share_via&utm_content=profile&utm_medium=ios_app",2024-11-11T17:28:17.989Z,,,,,,,,,,,,,,,,,,,,,,,,,,,,,,,,,,,,,,,,,,,,,,,,,,,,,,,,,,,0,,,false,,,,,,,,,,,,,,,,false,,,,0,false,1,0,1,,👍,false,false,,,,,,,,,,,,,,,,,,,,,,,,,,,,,,2024-11-11T17:28:17.989000+00:00,false,0,juanimpacts.com,
1305581503203512480,,,,,,,,,,,0,arulbenjamin,646955633979031562,0,arulbenjamin,,1303438635772809311,,"Hi everyone, I am Arul Benjamin from IBM. I am a technical architect working on multiple tech stacks. Holding 11 years of experience in Mainframes, Java, Python and recently exploring and teaching Gen AI. 

My LinkedIn : https://linkedin.com/in/arulbenjamin",2024-11-11T17:14:46.895Z,,,,,,,,,,,,,,,,,,,,,,,,,,,,,,,,,,,,,,,,,,,,,,,,,,,,,,,,,,,0,,,false,,,,,,,,,,,,,,,,false,,,,0,false,1,0,1,,👍,false,false,,,,,,,,,,,,,,,,,,,,,,,,,,,,,,2024-11-11T17:14:46.895000+00:00,false,0,arulbenjamin,
1305580606981279864,,,,,,,,,,,0,Rahul,1305577755051687996,0,rahul_84247,,1303438635772809311,,"Hello All, Myself Rahul Gupta from India. I have 10+ years of experience in Data Analytics, ML and AI. I am here to enhance my skills in Gen AI domain. Linkedin - https://www.linkedin.com/in/rahul-kumar-gupta-406b2676/",2024-11-11T17:11:13.219Z,,,,,,,,,,,,,,,,,,,,,,,,,,,,,,,,,,,,,,,,,,,,,,,,,,,,,,,,,,,0,,,false,,,,,,,,,,,,,,,,false,,,,0,false,1,0,1,,👍,false,false,,,,,,,,,,,,,,,,,,,,,,,,,,,,,,2024-11-11T17:11:13.219000+00:00,false,0,rahul_84247,
1305580479168254093,,,,,77eb31f53bf8c3ea436d5929ffd5e1bc,,,,,,0,Akhil Theerthala,1280936598220832793,0,thestorytaste_05514,,1303438635772809311,,"Hi everyone I’m Akhil from Bengaluru, India! i’ve recently started working as a data scientist. Nice to meet you all!
My LinkedIn profile: https://linkedin.com/in/akhil-theerthala

Let’s connect!",2024-11-11T17:10:42.746Z,2024-11-11T17:13:24.040000+00:00,,,,,,,,,,,,,,,,,,,,,,,,,,,,,,,,,,,,,,,,,,,,,,,,,,,,,,,,,,0,,,false,,,,,,,,,,,,,,,,false,,,,,,,,,,,,,,,,,,,,,,,,,,,,,,,,,,,,,,,,,,2024-11-11T17:10:42.746000+00:00,false,0,thestorytaste_05514,
1305580177497260115,,,,,,,,,,,0,Muzammil,1167310482714148994,0,muzzy_98,,1303438635772809311,,"Hello everyone my name is Muzammil I'm a growth-oriented Computer Science graduate with a curiosity and passion for Data Science and Software Engineering. I also have a master's in Data Science and Analytics and have worked both as a data analyst/scientist and software engineer. 

Looking to learn new things while looking for my next role. I'm from canada but open to opportunities aboard 

Hobbies Include fitness, basketball, video games, and watching sitcoms.

Github: https://github.com/Muzammil-Elahi
LinkedIn: https://www.linkedin.com/in/muzammil-elahi/",2024-11-11T17:09:30.822Z,2024-11-11T17:13:48.875000+00:00,,,,1975079,1,Muzammil-Elahi has 14 repositories available. Follow their code on GitHub.,,,,GitHub,,,0,420,NccFDwKoqMiJeXaGepdn+Gd1is84+IwD,1,https://images-ext-1.discordapp.net/external/V2OwZQhrRW0oGzyTv7WtYooVxYNFOXfxAG8uOOV5XA4/%3Fv%3D4%3Fs%3D400/https/avatars.githubusercontent.com/u/25537998,https://avatars.githubusercontent.com/u/25537998?v=4?s=400,420,Muzammil-Elahi - Overview,link,https://github.com/Muzammil-Elahi,,,,,,,,,,,,,,,,,,,,,,,,,,,,,,,,,,,,0,,,false,,,,,,,,,,,,,,,,false,,,,0,false,2,0,2,,👍,false,false,,,,,,,,,,,,,,,,,,,,,,,,,,,,,,2024-11-11T17:09:30.822000+00:00,false,0,muzzy_98,
1305579673064964106,,,,,,,,,,,0,coder,1305577848135876648,0,coder_53858,,1303438635772809311,,"Hey All, Aparna here from India, I am a Senior Software Engineer. I am a coder, love geeking out Architecture's and software system's. Stepping stones into the AI world. Would you be great to catchup and collaborate. You can find me on  https://www.linkedin.com/in/aparna-rm/",2024-11-11T17:07:30.556Z,,,,,,,,,,,,,,,,,,,,,,,,,,,,,,,,,,,,,,,,,,,,,,,,,,,,,,,,,,,0,,,false,,,,,,,,,,,,,,,,false,,,,,,,,,,,,,,,,,,,,,,,,,,,,,,,,,,,,,,,,,,2024-11-11T17:07:30.556000+00:00,false,0,coder_53858,
