id,activity,application,application_id,attachments,author.avatar,author.avatar_decoration_data,author.avatar_decoration_data.asset,author.avatar_decoration_data.expires_at,author.avatar_decoration_data.sku_id,author.clan,author.discriminator,author.global_name,author.id,author.public_flags,author.username,call,channel_id,components,content,date,edited_timestamp,embeds,embeds.0.author.name,embeds.0.author.url,embeds.0.color,embeds.0.content_scan_version,embeds.0.description,embeds.0.footer.icon_url,embeds.0.footer.proxy_icon_url,embeds.0.footer.text,embeds.0.provider.name,embeds.0.provider.url,embeds.0.reference_id,embeds.0.thumbnail.flags,embeds.0.thumbnail.height,embeds.0.thumbnail.placeholder,embeds.0.thumbnail.placeholder_version,embeds.0.thumbnail.proxy_url,embeds.0.thumbnail.url,embeds.0.thumbnail.width,embeds.0.title,embeds.0.type,embeds.0.url,embeds.0.video.flags,embeds.0.video.height,embeds.0.video.placeholder,embeds.0.video.placeholder_version,embeds.0.video.proxy_url,embeds.0.video.url,embeds.0.video.width,embeds.1.color,embeds.1.content_scan_version,embeds.1.description,embeds.1.provider.name,embeds.1.thumbnail.flags,embeds.1.thumbnail.height,embeds.1.thumbnail.placeholder,embeds.1.thumbnail.placeholder_version,embeds.1.thumbnail.proxy_url,embeds.1.thumbnail.url,embeds.1.thumbnail.width,embeds.1.title,embeds.1.type,embeds.1.url,embeds.2.color,embeds.2.content_scan_version,embeds.2.description,embeds.2.provider.name,embeds.2.thumbnail.flags,embeds.2.thumbnail.height,embeds.2.thumbnail.placeholder,embeds.2.thumbnail.placeholder_version,embeds.2.thumbnail.proxy_url,embeds.2.thumbnail.url,embeds.2.thumbnail.width,embeds.2.title,embeds.2.type,embeds.2.url,flags,interaction,mention_channels,mention_everyone,mentions,mentions.0.avatar,mentions.0.avatar_decoration_data,mentions.0.clan,mentions.0.discriminator,mentions.0.global_name,mentions.0.id,mentions.0.public_flags,mentions.0.username,message_reference,message_reference.channel_id,message_reference.guild_id,message_reference.message_id,message_reference.type,nonce,pinned,position,reactions,reactions.0.burst_colors,reactions.0.burst_count,reactions.0.burst_me,reactions.0.count,reactions.0.count_details.burst,reactions.0.count_details.normal,reactions.0.emoji.id,reactions.0.emoji.name,reactions.0.me,reactions.0.me_burst,reactions.1.burst_colors,reactions.1.burst_count,reactions.1.burst_me,reactions.1.count,reactions.1.count_details.burst,reactions.1.count_details.normal,reactions.1.emoji.id,reactions.1.emoji.name,reactions.1.me,reactions.1.me_burst,reactions.2.burst_colors,reactions.2.burst_count,reactions.2.burst_me,reactions.2.count,reactions.2.count_details.burst,reactions.2.count_details.normal,reactions.2.emoji.id,reactions.2.emoji.name,reactions.2.me,reactions.2.me_burst,referenced_message,resolved,role_subscription_data,sticker_items,sticker_items.0.format_type,sticker_items.0.id,sticker_items.0.name,stickers,thread,timestamp,tts,type,userName,webhook_id
1308656206486835241,,,,,eb075071d099da7408cb374bf869dd4b,,,,,,0,macd,132124213132787712,0,macd_,,1303438635772809311,,definitely look at uploading to https://www.kaggle.com/datasets - you never know when someone might be looking for that exact dataset!,2024-11-20T04:52:33.283Z,,,,,35516,0,"Download Open Datasets on 1000s of Projects + Share Projects on One Platform. Explore Popular Topics Like Government, Sports, Medicine, Fintech, Food, More. Flexible Data Ingestion.",,,,,,1308656206486835241,,,,,,,,Find Open Datasets and Machine Learning Projects | Kaggle,link,https://www.kaggle.com/datasets,,,,,,,,,,,,,,,,,,,,,,,,,,,,,,,,,,,,0,,,false,,,,,0,shorch,1086222878527209472,0,danila.makeev,,1303438635772809311,1101210829807956100,1308558770330140727,0,,false,0,,,,,,,,,,,,,,,,,,,,,,,,,,,,,,,,,,,,,,,,,2024-11-20T04:52:33.283000+00:00,false,19,macd_,
1308462155418308608,,,,,1e35fbf9d3622ac9607ae2f178835a2b,,,,,,0,Nitin Kumar,1305237452465766473,0,nitinkumar237,,1303438635772809311,,"Hey Data Analysts and mates , Feel free to build up a connect with me over linkedIn : https://www.linkedin.com/in/nitin-kumar-8213361a6/",2024-11-19T16:01:27.903Z,,,,,,,,,,,,,,,,,,,,,,,,,,,,,,,,,,,,,,,,,,,,,,,,,,,,,,,,,,,0,,,false,,,,,,,,,,,,,,,,false,,,,,,,,,,,,,,,,,,,,,,,,,,,,,,,,,,,,,,,,,,2024-11-19T16:01:27.903000+00:00,false,0,nitinkumar237,
1308377435602944042,,,,,,,,,,,0,Raahim Naeem Ali,1308369423337259008,0,raahim81,,1303438635772809311,,"Hello everyone, my name is Raahim and I'm a software engineer, currently working with Python, AWS and data-science/NLP based projects. 

https://www.linkedin.com/in/raahim-naeem-ali/",2024-11-19T10:24:49.125Z,,,,,,,,,,,,,,,,,,,,,,,,,,,,,,,,,,,,,,,,,,,,,,,,,,,,,,,,,,,0,,,false,,,,,,,,,,,,,,,,false,,,,,,,,,,,,,,,,,,,,,,,,,,,,,,,,,,,,,,,,,,2024-11-19T10:24:49.125000+00:00,false,0,raahim81,
1308363414904766485,,,,,1cb98e3caa693728dce88b981458d3ce,,,,,,0,karima,861539210103750656,0,karima.ibrahim,,1303438635772809311,,"hello every one , my name is karima , from egypt , developer and post-grade researcher at data science 
https://www.linkedin.com/in/karima-sobhy/",2024-11-19T09:29:06.330Z,,,,,,,,,,,,,,,,,,,,,,,,,,,,,,,,,,,,,,,,,,,,,,,,,,,,,,,,,,,0,,,false,,,,,,,,,,,,,,,,false,,,,,,,,,,,,,,,,,,,,,,,,,,,,,,,,,,,,,,,,,,2024-11-19T09:29:06.330000+00:00,false,0,karima.ibrahim,
1308350968454451210,,,,,,,,,,,0,Priyanka Srivastava,1305198827032285320,0,priyankasrivastava0474,,1303438635772809311,,"Hi Everyone as we have completed this 5 day journey, would like to extend my gratitude to Kaggle and Google for organizing such a fantastic course with such interesting content and interactive code labs. It was a pleasure be a part of such an enthusiastic group of people.
Let’s connect with me on LinkedIn and continue our journey together 

http://linkedin.com/in/priyanka-srivastava-52350771",2024-11-19T08:39:38.865Z,,,,,,,,,,,,,,,,,,,,,,,,,,,,,,,,,,,,,,,,,,,,,,,,,,,,,,,,,,,0,,,false,,,,,,,,,,,,,,,,false,,,,0,false,1,0,1,,👍,false,false,,,,,,,,,,,,,,,,,,,,,,,,,,,,,,2024-11-19T08:39:38.865000+00:00,false,0,priyankasrivastava0474,
1308332890337050655,,,,,1e35fbf9d3622ac9607ae2f178835a2b,,,,,,0,Nitin Kumar,1305237452465766473,0,nitinkumar237,,1303438635772809311,,"Hey Data Analysts and mates , Feel free to build up a connect with me over linkedIn : https://www.linkedin.com/in/nitin-kumar-8213361a6/",2024-11-19T07:27:48.706Z,,,,,,,,,,,,,,,,,,,,,,,,,,,,,,,,,,,,,,,,,,,,,,,,,,,,,,,,,,,0,,,false,,,,,,,,,,,,,,,,false,,,,0,false,2,0,2,,👋,false,false,,,,,,,,,,,,,,,,,,,,,,,,,,,,,,2024-11-19T07:27:48.706000+00:00,false,0,nitinkumar237,
1308299952929116160,,,,,,,,,,,0,Beat-Buddy,1153407987998806037,0,rishiazh_89629,,1303438635772809311,,"Python SQL Integration using PyMySql 💥


https://www.linkedin.com/posts/rishi-maddheshiya-020b14267_python-sql-datascience-activity-7264287648293240832-vl5V?utm_source=share&utm_medium=member_android",2024-11-19T05:16:55.816Z,,,,,,1,"🔗 Python Meets SQL: My Journey with PyMySQL Integration

LLA 🟢— Every time I saw impressive integrations during my data science course, I wondered: How do…",,,,,,,0,470,l3gKO5ZPeEuId1hrj4n3mYg=,1,https://images-ext-1.discordapp.net/external/ZDfstU7ZXzef7cmQwRXc3XpQYK4jk4_84sCaWemnwOM/%3Fe%3D2147483647%26v%3Dbeta%26t%3DtHdXTHFAGO0YTxiE1PeSTmuw4erQLNV9DthiSX7CKDs/https/media.licdn.com/dms/image/v2/D5622AQHK3dcahe7Gqg/feedshare-shrink_2048_1536/feedshare-shrink_2048_1536/0/1731941136796,https://media.licdn.com/dms/image/v2/D5622AQHK3dcahe7Gqg/feedshare-shrink_2048_1536/feedshare-shrink_2048_1536/0/1731941136796?e=2147483647&v=beta&t=tHdXTHFAGO0YTxiE1PeSTmuw4erQLNV9DthiSX7CKDs,1000,Rishi Maddheshiya on LinkedIn: #python #sql #datascience #githubjou...,article,https://www.linkedin.com/posts/rishi-maddheshiya-020b14267_python-sql-datascience-activity-7264287648293240832-vl5V?utm_source=share&utm_medium=member_android,,,,,,,,,,,,,,,,,,,,,,,,,,,,,,,,,,,,0,,,false,,,,,,,,,,,,,,,,false,,,,,,,,,,,,,,,,,,,,,,,,,,,,,,,,,,,,,,,,,,2024-11-19T05:16:55.816000+00:00,false,0,rishiazh_89629,
1308142734657454142,,,,,1e35fbf9d3622ac9607ae2f178835a2b,,,,,,0,Nitin Kumar,1305237452465766473,0,nitinkumar237,,1303438635772809311,,"Hey Data Analysts and mates , Feel free to build up a connect with me over linkedIn : https://www.linkedin.com/in/nitin-kumar-8213361a6/",2024-11-18T18:52:12.059Z,,,,,,,,,,,,,,,,,,,,,,,,,,,,,,,,,,,,,,,,,,,,,,,,,,,,,,,,,,,0,,,false,,,,,,,,,,,,,,,,false,,,,,,,,,,,,,,,,,,,,,,,,,,,,,,,,,,,,,,,,,,2024-11-18T18:52:12.059000+00:00,false,0,nitinkumar237,
1308140049895784579,,,,,,,,,,,0,Aslău Patrick,892522022108819537,0,aslaupatrick,,1303438635772809311,,"Hi to everyone! I am Alexandru Patrick Aslău from Romania! You can connect with me on linkedIn, this is the link: https://www.linkedin.com/in/alexandru-aslău-328a3a301",2024-11-18T18:41:31.962Z,,,,,,,,,,,,,,,,,,,,,,,,,,,,,,,,,,,,,,,,,,,,,,,,,,,,,,,,,,,0,,,false,,,,,,,,,,,,,,,,false,,,,,,,,,,,,,,,,,,,,,,,,,,,,,,,,,,,,,,,,,,2024-11-18T18:41:31.962000+00:00,false,0,aslaupatrick,
1308129728338722857,,,,,,,,,,,0,RujN,876908936006086706,0,rujn123,,1303438635772809311,,Hi Everyone! This is Rujuta here and this is my LinkedIn - https://www.linkedin.com/in/rujutan?utm_source=share&utm_campaign=share_via&utm_content=profile&utm_medium=android_app,2024-11-18T18:00:31.111Z,,,,,,,,,,,,,,,,,,,,,,,,,,,,,,,,,,,,,,,,,,,,,,,,,,,,,,,,,,,0,,,false,,,,,,,,,,,,,,,,false,,,,,,,,,,,,,,,,,,,,,,,,,,,,,,,,,,,,,,,,,,2024-11-18T18:00:31.111000+00:00,false,0,rujn123,
1308059466142580792,,,,,8569adcbd36c70a7578c017bf5604ea5,,,,,,0,Yondubaegi,1225400847102382162,0,yondubaegi,,1303438635772809311,,"Hi everybody, I'm Jiyeon Lee. I'm an aspiring product manager trying to specialize in AI field. This is my linkedin https://www.linkedin.com/in/jadejylee/",2024-11-18T13:21:19.298Z,,,,,,,,,,,,,,,,,,,,,,,,,,,,,,,,,,,,,,,,,,,,,,,,,,,,,,,,,,,0,,,false,,,,,,,,,,,,,,,,false,,,,0,false,2,0,2,,👋,false,false,,,,,,,,,,,,,,,,,,,,,,,,,,,,,,2024-11-18T13:21:19.298000+00:00,false,0,yondubaegi,
1307727186995839076,,,,,,,,,,,0,SureshRam,1306399193404805151,0,sureshram_65627,,1303438635772809311,,"A big thank you to Google for organizing the incredible 5-Day Gen AI Intensive program! It was an amazing learning experience, and I'm thrilled to have earned the Kaggle badge for completing it.

Grateful to be part of such an inspiring community of participants. Let's continue growing together! Feel free to connect with me on LinkedIn: Suresh Kumar Thulasiram. 🚀✨ https://www.linkedin.com/in/sureshkumarthulasiram3007",2024-11-17T15:20:57.776Z,,,,,,,,,,,,,,,,,,,,,,,,,,,,,,,,,,,,,,,,,,,,,,,,,,,,,,,,,,,0,,,false,,,,,,,,,,,,,,,,false,,,,,,,,,,,,,,,,,,,,,,,,,,,,,,,,,,,,,,,,,,2024-11-17T15:20:57.776000+00:00,false,0,sureshram_65627,
1307707310839431189,,,,,,,,,,,0,Amir,1307703770762838026,0,amir_45212,,1303438635772809311,,Hi everybody. I am Amir and this is my Linkedin: https://www.linkedin.com/in/amir-rajabi/,2024-11-17T14:01:58.931Z,,,,,,,,,,,,,,,,,,,,,,,,,,,,,,,,,,,,,,,,,,,,,,,,,,,,,,,,,,,0,,,false,,,,,,,,,,,,,,,,false,,,,,,,,,,,,,,,,,,,,,,,,,,,,,,,,,,,,,,,,,,2024-11-17T14:01:58.931000+00:00,false,0,amir_45212,
1307690690632749127,,,,,e0352424ef5be829d480aea3ec10e939,,,,,,0,umer0077,1124341245490253904,0,umerh007.,,1303438635772809311,,"https://www.kaggle.com/umerhaddii


Hi Newbies. I am Umer, a Data Scientist and Grandmaster.

Connect with me on Kaggle!

Happy journey.",2024-11-17T12:55:56.365Z,,,,,35516,1,"Machine Learning Specialization from Stanford
Studying Data Science, AI and ML
Data Analytics and AI Research",,,,,,,0,192,bD2CBQAV+lV8VHO6Sgt5nMv6B0d1iIB0Rw==,1,https://images-ext-1.discordapp.net/external/M2ZoKphK9MytxgLmvjAw0mY4YSErH_1-K19bGe_isdA/https/www.kaggle.com/static/images/tiers/Grandmaster%40192.png,https://www.kaggle.com/static/images/tiers/Grandmaster@192.png,192,Umer Haddii | Grandmaster,link,https://www.kaggle.com/umerhaddii,,,,,,,,,,,,,,,,,,,,,,,,,,,,,,,,,,,,0,,,false,,,,,,,,,,,,,,,,false,,,,0,false,1,0,1,,🚀,false,false,,0,false,1,0,1,,👍,false,false,,,,,,,,,,,,,,,,,,,,2024-11-17T12:55:56.365000+00:00,false,0,umerh007.,
1307683439159283714,,,,,,,,,,,0,,753803535128199270,0,claribar,,1303438635772809311,,"Hi, I’m Clara Ibarzabal! I’ve participated in NLP and MLOps projects, an Azure Hackathon, and I’m currently involved in computer vision research for the agroindustry. Let’s connect! https://www.linkedin.com/in/clara-ibarzabal/ This is my kaggle account: https://www.kaggle.com/claraibarzabal",2024-11-17T12:27:07.479Z,2024-11-17T12:30:18.812000+00:00,,,,35516,1,Kaggle profile for Clara Ibarzábal,,,,,,,0,192,FvmABYASBeetaXeJZHh2zy/6B3eFh4K7Nw==,1,https://images-ext-1.discordapp.net/external/AHWMgmOVeM8WF8EBBKNgw_kAsJEfkC3o3l5Q4I9_yGk/https/www.kaggle.com/static/images/tiers/Novice%40192.png,https://www.kaggle.com/static/images/tiers/Novice@192.png,193,Clara Ibarzábal | Novice,link,https://www.kaggle.com/claraibarzabal,,,,,,,,,,,,,,,,,,,,,,,,,,,,,,,,,,,,0,,,false,,,,,,,,,,,,,,,,false,,,,0,false,1,0,1,,👍,false,false,,0,false,1,0,1,,👋,false,false,,,,,,,,,,,,,,,,,,,,2024-11-17T12:27:07.479000+00:00,false,0,claribar,
1307669449054359634,,,,,796b3550a9816b3668044cbe97cc5ff7,,,,,,0,George Cowell,1306656732558135407,0,georgecowell00,,1303438635772809311,,"I'll help the first 10 people interested on how to  start earning $30k or more within 72hours, but you will reimburse me 10% of your profits when you receive it. Note: only interested people should send a friend request or  send me a dm!  ask me HOW !
https://t.me/Georgecowell
WhatsApp :+4(474)9543-3306",2024-11-17T11:31:31.978Z,,,,,,1,"Invest, stack and stay low key ☕📈",,,,Telegram,,,0,320,mPcFDwKaXHcFi4irWnd1qHadVkcLZIMA,1,https://images-ext-1.discordapp.net/external/1VPn_EpMFMfE85gXIcKMHKdE3dhSNrDfrmjO0XzdSas/https/cdn4.cdn-telegram.org/file/j0hp0GHuiNOFT8EwToR2CJXpdhQAun9PNvAHMYkuBSHjA0Tqx9QXdOuo7KDrLPiDPD3F05PCWh9jI6MTR-dUcYWF6j_ownVua7q70nMdo6LpOv1QDzysT9DmXfdGvUWGFGjVWf7qMv5xkph4FhE6Xo4RoPzZXVdKr-fybxPkiMO0i9s6vGjj4VcJ0zqGbP_wMLCHYHsWt664UYmSVhQmBV8HWotEsZo3ffhTboKXIEucQ9WA6jl1JoSkggHJJb9jmc3q0WDUUQD0y1ZQzKO2YIeNwG2FZva03ikApXJuxJ4mNzrZZ4X4R5eiGt8VebuzEJg7CCuu5XR24uBFLMvzkg.jpg,https://cdn4.cdn-telegram.org/file/j0hp0GHuiNOFT8EwToR2CJXpdhQAun9PNvAHMYkuBSHjA0Tqx9QXdOuo7KDrLPiDPD3F05PCWh9jI6MTR-dUcYWF6j_ownVua7q70nMdo6LpOv1QDzysT9DmXfdGvUWGFGjVWf7qMv5xkph4FhE6Xo4RoPzZXVdKr-fybxPkiMO0i9s6vGjj4VcJ0zqGbP_wMLCHYHsWt664UYmSVhQmBV8HWotEsZo3ffhTboKXIEucQ9WA6jl1JoSkggHJJb9jmc3q0WDUUQD0y1ZQzKO2YIeNwG2FZva03ikApXJuxJ4mNzrZZ4X4R5eiGt8VebuzEJg7CCuu5XR24uBFLMvzkg.jpg,320,George Cowell,link,https://t.me/Georgecowell,,,,,,,,,,,,,,,,,,,,,,,,,,,,,,,,,,,,0,,,false,,,,,,,,,,,,,,,,false,,,,0,false,1,0,1,,✅,false,false,,0,false,1,0,1,,👍,false,false,,,,,,,,,,,,,,,,,,,,2024-11-17T11:31:31.978000+00:00,false,0,georgecowell00,
1307604392978944041,,,,,,,,,,,0,arunkg99,763716559042248704,0,arunkg99.,,1303438635772809311,,https://www.linkedin.com/in/arunkumarnair/,2024-11-17T07:13:01.401Z,,,,,,,,,,,,,,,,,,,,,,,,,,,,,,,,,,,,,,,,,,,,,,,,,,,,,,,,,,,0,,,false,,,,,,,,,,,,,,,,false,,,,,,,,,,,,,,,,,,,,,,,,,,,,,,,,,,,,,,,,,,2024-11-17T07:13:01.401000+00:00,false,0,arunkg99.,
1307603429194989649,,,,,a908586255aafd73e83301a164c971a6,,,,,,0,Gourav,1251924941000147056,0,gourav_yadav,,1303438635772809311,,"Hey everyone, I really enjoyed taking this course with all of you!  It was a great experience.  If you'd like to stay in touch, my LinkedIn is:
https://www.linkedin.com/in/gouravyadav2",2024-11-17T07:09:11.617Z,,,,,,,,,,,,,,,,,,,,,,,,,,,,,,,,,,,,,,,,,,,,,,,,,,,,,,,,,,,0,,,false,,,,,,,,,,,,,,,,false,,,,,,,,,,,,,,,,,,,,,,,,,,,,,,,,,,,,,,,,,,2024-11-17T07:09:11.617000+00:00,false,0,gourav_yadav,
1307559915476357140,,,,,,,,,,,0,Viren_ML,1305050412818370571,0,viren_ml_38047,,1303438635772809311,,"Hello Kagglers! 👋

I’m actively looking to collaborate on Kaggle competitions and build strong teams for exciting challenges. Let’s connect, share skill sets, and explore opportunities to team up for competitions!

📌 Here’s my LinkedIn profile: https://www.linkedin.com/in/virendra-kumar-03277786/

Feel free to reach out if you’re interested in teaming up. Let’s make great things happen together! 🚀
@everyone",2024-11-17T04:16:17.138Z,,,,,,,,,,,,,,,,,,,,,,,,,,,,,,,,,,,,,,,,,,,,,,,,,,,,,,,,,,,0,,,false,,,,,,,,,,,,,,,,false,,,,,,,,,,,,,,,,,,,,,,,,,,,,,,,,,,,,,,,,,,2024-11-17T04:16:17.138000+00:00,false,0,viren_ml_38047,
1307559350562455572,,,,,,,,,,,0,Amit Dubey,1307557161080979506,0,amitdubey_67466,,1303438635772809311,,"Hello Guys, I really enjoyed my  journey with this course along with expert panel list.  It was really a great experience.  If you'd like to stay in touch, my LinkedIn is: https://www.linkedin.com/in/amit-dubey-bi/",2024-11-17T04:14:02.452Z,,,,,,,,,,,,,,,,,,,,,,,,,,,,,,,,,,,,,,,,,,,,,,,,,,,,,,,,,,,0,,,false,,,,,,,,,,,,,,,,false,,,,,,,,,,,,,,,,,,,,,,,,,,,,,,,,,,,,,,,,,,2024-11-17T04:14:02.452000+00:00,false,0,amitdubey_67466,
1307543808249954389,,,,,,,,,,,0,Devaki,1283422300544172125,0,devaki_52931,,1303438635772809311,,"Hello! I'm Devaki. Currently in Singapore, originally from India.
My Kaggle account: https://www.kaggle.com/devakivdevi 
and my LinkedIn: https://www.linkedin.com/in/devaki-v-devi-69629b154/ 😁",2024-11-17T03:12:16.876Z,,,,,35516,1,Kaggle profile for Devaki,,,,,,,0,192,FvmABYASBeetaXeJZHh2zy/6B3eFh4K7Nw==,1,https://images-ext-1.discordapp.net/external/AHWMgmOVeM8WF8EBBKNgw_kAsJEfkC3o3l5Q4I9_yGk/https/www.kaggle.com/static/images/tiers/Novice%40192.png,https://www.kaggle.com/static/images/tiers/Novice@192.png,193,Devaki | Novice,link,https://www.kaggle.com/devakivdevi,,,,,,,,,,,,,,,,,,,,,,,,,,,,,,,,,,,,0,,,false,,,,,,,,,,,,,,,,false,,,,0,false,1,0,1,,👍,false,false,,,,,,,,,,,,,,,,,,,,,,,,,,,,,,2024-11-17T03:12:16.876000+00:00,false,0,devaki_52931,
1307524762490245193,,,,,,,,,,,0,Paul James,1307500647859621972,0,pauljames_74800,,1303438635772809311,,"Hello I am paul I am a startup to data science and machine learning, an Electrical engineer with curiosity to derive insight from data to make well-informed decisions in the field of energy. Here is my LinkedIn profile: https://www.linkedin.com/in/paul-james-9a5239263 .",2024-11-17T01:56:36.013Z,,,,,,,,,,,,,,,,,,,,,,,,,,,,,,,,,,,,,,,,,,,,,,,,,,,,,,,,,,,0,,,false,,,,,,,,,,,,,,,,false,,,,,,,,,,,,,,,,,,,,,,,,,,,,,,,,,,,,,,,,,,2024-11-17T01:56:36.013000+00:00,false,0,pauljames_74800,
1307473232953081866,,,,,7ec4ea4929c29c1480e187856723421f,,,,,,0,Ryan,1195238926252769372,0,rlawton.cs,,1303438635772809311,,"Hey everyone, I really enjoyed taking this course with all of you!  It was a great experience.  If you'd like to stay in touch, my LinkedIn is: https://www.linkedin.com/in/rlawton714/",2024-11-16T22:31:50.414Z,,,,,,,,,,,,,,,,,,,,,,,,,,,,,,,,,,,,,,,,,,,,,,,,,,,,,,,,,,,0,,,false,,,,,,,,,,,,,,,,false,,,,,,,,,,,,,,,,,,,,,,,,,,,,,,,,,,,,,,,,,,2024-11-16T22:31:50.414000+00:00,false,0,rlawton.cs,
1307436229599432704,,,,,09a97986abf83cbe099d0e9094c4bc80,,,,,,0,HandicapSkater,1049969981112201226,0,handicapskater,,1303438635772809311,,"Hello, my name is Troy and I have established inline skates as a mobility aid for my disability. I have used biomechanics and now using data science to demonstrate that a PICE (Pain-Induced Cardiovascular Event) is triggered while walking even a few steps, yet skate 12-mile skates around San Francisco every week without any problems. I have setup a website https://HandicapSkater.com going through much of this with links to a data science notebook, tableau viz, pdfs, ... My goal is to make america healthier through data science. Here is my LinkedIn profile https://www.linkedin.com/in/troy-wilkes-a1311673/ and LinkedIn company profile: https://www.linkedin.com/company/103320223",2024-11-16T20:04:48.127Z,2024-11-16T20:05:14.322000+00:00,,,,,0,"Login to LinkedIn to keep in touch with people you know, share ideas, and build your career.",,,,LinkedIn,,,,,,,,,,"LinkedIn Login, Sign in | LinkedIn",link,https://www.linkedin.com/company/103320223,,,,,,,,,,,,,,,,,,,,,,,,,,,,,,,,,,,,0,,,false,,,,,,,,,,,,,,,,false,,,,,,,,,,,,,,,,,,,,,,,,,,,,,,,,,,,,,,,,,,2024-11-16T20:04:48.127000+00:00,false,0,handicapskater,
1307397613250805790,,,,,,,,,,,0,Aniket Kumare,1307387652575596636,0,aniket_mh29,,1303438635772809311,,Connect me on LinkedIn -https://www.linkedin.com/in/aniketmh29?utm_source=share&utm_campaign=share_via&utm_content=profile&utm_medium=android_app,2024-11-16T17:31:21.272Z,,,,,,,,,,,,,,,,,,,,,,,,,,,,,,,,,,,,,,,,,,,,,,,,,,,,,,,,,,,0,,,false,,,,,,,,,,,,,,,,false,,,,,,,,,,,,,,,,,,,,,,,,,,,,,,,,,,,,,,,,,,2024-11-16T17:31:21.272000+00:00,false,0,aniket_mh29,
1307392533919432756,,,,,e75dfd29e828b6c1b18632f4f29dad3c,,,,,,0,vashi,734523915262492692,0,vashi2396,,1303438635772809311,,"Hi All,

It's great connecting with you all. How have you been? Hope you all doing great.

I have been following AI Coforge for a time and wanted to work in python or data science 

I am fascinated how AI/Gen AI has been using for Qa purpose via chatgpt/gemini and looking forward to see AI into action like Devine( to do tasks/Automation) and the  thinking abilities it has.

Right now I am Building application on top of LLM Models.

Recently I replicate the zapier application of Open AI for discord. It is a Conversational AI tool, basically you can talk/send message to anyone in your contacts via voice instructions(like Siri).


Here is the link of a demo of it:

https://www.dropbox.com/scl/fi/h9506ipn0rcxvlwfuldjb/Discord_AI_Chatbot-Made-with-Clipchamp-1.mp4?rlkey=x1re2za8zwdxn0zzeygki8p5r&st=yeerj2vz&dl=0

Thanks

Connect me: https://www.linkedin.com/in/vashisth-malik?utm_source=share&utm_campaign=share_via&utm_content=profile&utm_medium=android_app",2024-11-16T17:11:10.265Z,,,,,,1,Shared with Dropbox,,,,Dropbox,,,0,675,iwgKFIJPZFd1iXd3d3dviPh0hw==,1,https://images-ext-1.discordapp.net/external/hslkpZKtWgGA18iBpA8dCJYYTcn37T87pt8CY9WnHpg/%3Fpreserve_transparency%3DFalse%26rlkey%3Dx1re2za8zwdxn0zzeygki8p5r%26secure_hash%3D%26size%3D1200x600%26size_mode%3D4/https/www.dropbox.com/temp_thumb_from_token/c/h9506ipn0rcxvlwfuldjb,https://www.dropbox.com/temp_thumb_from_token/c/h9506ipn0rcxvlwfuldjb?preserve_transparency=False&rlkey=x1re2za8zwdxn0zzeygki8p5r&secure_hash=&size=1200x600&size_mode=4,1200,Discord_AI_Chatbot - Made with Clipchamp (1).mp4,article,https://www.dropbox.com/scl/fi/h9506ipn0rcxvlwfuldjb/Discord_AI_Chatbot-Made-with-Clipchamp-1.mp4?rlkey=x1re2za8zwdxn0zzeygki8p5r&st=yeerj2vz&dl=0,,,,,,,,,,,,,,,,,,,,,,,,,,,,,,,,,,,,1024,,,false,,,,,,,,,,,,,,,,false,,,,,,,,,,,,,,,,,,,,,,,,,,,,,,,,,,,,,,,,,,2024-11-16T17:11:10.265000+00:00,false,0,vashi2396,
1307369819942948938,,,,,5bb3c849c3bf5cd2228548b63a1183d2,,,,,,0,Kervin,826359833006571530,128,zhang31731,,1303438635772809311,,"Hi. I'm a seasoned full stack developer and have experience on Web,Mobile and Desktop app development
Technologies: React, PostgreSQL, MySQL, Next.js, VueJS, Nuxt.js, Javascript, Typescript, Tailwind, Git, MongoDB, Electron, Wails, Laravel,Shopify etc
Recently I have worked with Next and tailwind css, three.js for 3d website development and shopify site building.
I am looking for paid job
https://main--portfolio-0317.netlify.app/
Thank you.",2024-11-16T15:40:54.831Z,,,,,16719421,0,Portfolio Site,,,,,,,,,,,,,,Full stack developer with ~ 8 years of experience. Check out for more.,link,https://main--portfolio-0317.netlify.app/,,,,,,,,,,,,,,,,,,,,,,,,,,,,,,,,,,,,0,,,false,,,,,,,,,,,,,,,,false,,,,,,,,,,,,,,,,,,,,,,,,,,,,,,,,,,,,,,,,,,2024-11-16T15:40:54.831000+00:00,false,0,zhang31731,
1307321005190025288,,,,,,,,,,,0,Viren_ML,1305050412818370571,0,viren_ml_38047,,1303438635772809311,,"Hello Kagglers! 👋

I’m actively looking to collaborate on Kaggle competitions and build strong teams for exciting challenges. Let’s connect, share skill sets, and explore opportunities to team up for competitions!

📌 Here’s my LinkedIn profile: https://www.linkedin.com/in/virendra-kumar-03277786/

Feel free to reach out if you’re interested in teaming up. Let’s make great things happen together! 🚀",2024-11-16T12:26:56.487Z,,,,,,,,,,,,,,,,,,,,,,,,,,,,,,,,,,,,,,,,,,,,,,,,,,,,,,,,,,,0,,,false,,,,,,,,,,,,,,,,false,,,,,,,,,,,,,,,,,,,,,,,,,,,,,,,,,,,,,,,,,,2024-11-16T12:26:56.487000+00:00,false,0,viren_ml_38047,
1307276291493597205,,,,,,,,,,,0,SanthoshM,1287677056569577482,0,santhoshm_40155,,1303438635772809311,,Hi Everyone! I'm Santhosh from India. Happy learning!!! https://www.linkedin.com/in/santhoshkumarmallojwala/,2024-11-16T09:29:15.911Z,,,,,,,,,,,,,,,,,,,,,,,,,,,,,,,,,,,,,,,,,,,,,,,,,,,,,,,,,,,0,,,false,,,,,,,,,,,,,,,,false,,,,,,,,,,,,,,,,,,,,,,,,,,,,,,,,,,,,,,,,,,2024-11-16T09:29:15.911000+00:00,false,0,santhoshm_40155,
1307253991394250752,,,,,,,,,,,0,,828448197189566554,0,almirantenarval,,1303438635772809311,,"Hello! I'm Dalai from Mexico, nice to meet you all! https://www.linkedin.com/in/dalai-aguirre-jimenez/ https://www.upwork.com/freelancers/~01b3b2c550a2857bf8?viewMode=1",2024-11-16T08:00:39.153Z,,,,,,,,,,,,,,,,,,,,,,,,,,,,,,,,,,,,,,,,,,,,,,,,,,,,,,,,,,,0,,,false,,,,,,,,,,,,,,,,false,,,,,,,,,,,,,,,,,,,,,,,,,,,,,,,,,,,,,,,,,,2024-11-16T08:00:39.153000+00:00,false,0,almirantenarval,
1307245098643361814,,,,,,,,,,,0,Ratnesh K,1291686356233224256,0,ratneshk_90890,,1303438635772809311,,"Hi everyone! I am Ratnesh from India, I am experience proffessional working in ML, AI and APIs nice to connect you!🙂 
https://www.linkedin.com/in/ratneshkushwaha/",2024-11-16T07:25:18.956Z,,,,,,,,,,,,,,,,,,,,,,,,,,,,,,,,,,,,,,,,,,,,,,,,,,,,,,,,,,,0,,,false,,,,,,,,,,,,,,,,false,,,,,,,,,,,,,,,,,,,,,,,,,,,,,,,,,,,,,,,,,,2024-11-16T07:25:18.956000+00:00,false,0,ratneshk_90890,
